id,name,tier,logo,url,description_fr,description_en
acme-cloud,Acme Cloud,platinum,/sponsors/acme-cloud.svg,https://acmecloud.example.com,"Leader mondial des solutions cloud-native pour l'entreprise.","Global leader in cloud-native enterprise solutions."
kube-corp,KubeCorp,platinum,/sponsors/kubecorp.svg,https://kubecorp.example.com,"Solutions Kubernetes pour l'entreprise.","Enterprise Kubernetes solutions."
cloud-forge,CloudForge,gold,/sponsors/cloudforge.svg,https://cloudforge.example.com,"Plateforme de CI/CD cloud-native.","Cloud-native CI/CD platform."
stack-ops,StackOps,silver,/sponsors/stackops.svg,https://stackops.example.com,"Observabilité pour les équipes plateforme.","Observability for platform teams."
cncf-paris,CNCF Paris Meetup,community,/sponsors/cncf-paris.svg,https://cncf.io,"Communauté cloud-native de Paris.","The Paris cloud-native community."
nebula-stack,NebulaStack,platinum,/sponsors/nebula-stack.svg,https://nebulastack.example.com,"Plateforme d'IA cloud-native pour l'entreprise.","Cloud-native AI platform for the enterprise."
mesh-ops,MeshOps,silver,/sponsors/mesh-ops.svg,https://meshops.example.com,"Service mesh managé pour les architectures distribuées.","Managed service mesh for distributed architectures."
kubernetes-fr,Kubernetes France,community,/sponsors/kubernetes-fr.svg,https://kubernetes.fr.example.com,"Groupe d'utilisateurs Kubernetes francophones.","French-speaking Kubernetes user group."
